{"$schema":"https://json-schema.org/draft/2020-12/schema","title":"Projectile Program v3","type":"object","required":["schemaVersion","id","domain","entryPoints"],"properties":{"schemaVersion":{"const":3},"id":{"type":"string","minLength":1},"domain":{"type":"string"},"parameters":{"type":"object"},"entryPoints":{"type":"object"}}}
